Job Category,Description
Agile Project Manager,"A project manager who specializes in leading and managing projects using agile methodologies, facilitating effective communication, and ensuring project success through iterative development and collaboration."
Technical Project Manager,"A project manager with a strong technical background who oversees and coordinates technical projects, ensuring that teams meet deadlines, adhere to technical specifications, and deliver successful solutions."
Product Manager,"Responsible for developing and managing a product or product portfolio, defining product strategy, conducting market research, and collaborating with development teams to bring products to market."
Delivery Manager,"Oversees the end-to-end delivery of projects, ensuring they are completed on time, within scope, and meet quality standards. Manages resources, risks, and client relationships."
Offshore/Onsite Coordinator,"Coordinates activities and communication between offshore and onsite teams to ensure smooth collaboration, effective resource allocation, and successful project execution."
Cloud Solutions Manager,"Manages cloud-based solutions and services, assessing cloud strategies, ensuring scalability and security, and driving the adoption of cloud technologies within an organization."
Quality Assurance Manager,"Leads a team responsible for testing and ensuring the quality of software applications, defining testing strategies, and implementing quality assurance processes."
Test Manager,"Manages the testing process and team, defines testing strategies, creates test plans, and ensures the quality and reliability of software applications."
Global Team Manager,"Manages and coordinates teams located in different geographic locations, ensuring effective communication, collaboration, and project delivery across borders."
EDI Analyst,"Focuses on Electronic Data Interchange (EDI) transactions and formats, analyzing and implementing EDI solutions to facilitate seamless data exchange between different systems."
Healthcare Business Analyst,"Specializes in the healthcare domain, analyzing business processes, regulations, and requirements to support the development and improvement of healthcare-related systems."
Medicare/Medicaid Analyst,"Specializes in analyzing and managing Medicare and Medicaid-related processes, policies, and data to ensure compliance and efficient healthcare service delivery."
EDI Implementation Analyst,"Involved in the implementation of EDI solutions, coordinating with stakeholders, testing EDI transactions, and troubleshooting implementation issues."
Claims Analyst,"Analyzes and processes insurance claims, ensuring accuracy, compliance with regulations, and timely resolution of claims."
Business Process Modeler,"Creates and analyzes business process models, using tools like BPMN (Business Process Model and Notation), to improve organizational efficiency and effectiveness."
Construction Project Manager,"Manages construction projects from inception to completion, overseeing planning, budgeting, resource allocation, and construction activities."
Insurance Project Manager,"Manages projects within the insurance industry, such as product launches, process improvements, and system implementations, to meet business objectives."
Six Sigma Project Manager,"Utilizes Six Sigma methodologies to manage projects aimed at process improvement, waste reduction, and increased efficiency within an organization."
IT Project Manager,"Manages information technology projects, overseeing the development, implementation, and maintenance of IT systems and solutions."
Business Strategist,"Develops and implements strategic plans and initiatives to achieve business objectives, improve competitiveness, and drive growth."
Data Analyst,"Analyzes and interprets data, using statistical techniques and data visualization tools, to provide insights and support decision-making."